{
  "kicker": "전개 로드맵 상한 확인",
  "title": "보고 플랫폼 전사 전개 6단계 전체 일정표",
  "milestones": [
    {
      "date": "2025-10-20",
      "name": "요구 정의와 승인",
      "desc": "본부별 보고 유형 12종 전수 조사와 표준화",
      "status": "done",
      "tag": "완료됨"
    },
    {
      "date": "2025-12-15",
      "name": "파일럿 부서 검증",
      "desc": "설계 1팀 12명이 초안 게시 흐름을 검증",
      "status": "done"
    },
    {
      "date": "2026-03-02",
      "name": "팀 게시판 전면 전환",
      "desc": "주간보고 게시와 승인 절차를 일원화 완료",
      "status": "done"
    },
    {
      "date": "2026-05-11",
      "name": "종합보고 자동 집계",
      "desc": "부서 초안이 본부 종합보고로 자동 조립",
      "status": "done"
    },
    {
      "date": "2026-07-06",
      "name": "전사 확산 진행",
      "desc": "3개 본부 41팀으로 순차 적용을 진행 중",
      "status": "current",
      "tag": "진행"
    },
    {
      "date": "2026-11-30",
      "name": "감사 자료 연동",
      "desc": "전 버전 이력을 외부 감사 자료로 연동",
      "status": "planned",
      "tag": "예정됨"
    }
  ],
  "nowLabel": "오늘 여기",
  "footnote": {
    "pre": "완료 4단계 동안 게시된 보고서 누계 ",
    "strong": "1,284건",
    "post": "— 전 버전이 아카이브에 남아 있습니다"
  },
  "frame": {
    "brand": "ReportArchive 운영협의회",
    "idx": "05",
    "total": "07"
  }
}
